Agency Tracking Number,Company,Award Title,Agency,Branch,Phase,Program,Proposal Award Date,Contract End Date,UEI,Award Amount,Abstract,NAICS,PSC,Office,CET,source_url
ARMY-EXAMPLE-001,Illustrative Terrain Robotics LLC,Autonomous robotic breach reconnaissance,DEPARTMENT OF THE ARMY,U.S. Army S&T Screen — Synthetic Example,Phase II,SBIR,2026-06-08,2026-11-30,EXAMPLEUEI001,1800000,Autonomous ground mobility and sensing for obstacle characterization.,541715,AC13,,Autonomous Systems,
ARMY-EXAMPLE-002,Illustrative Resilient Networks Inc.,Assured PNT for resilient tactical mesh networks,DEPARTMENT OF THE ARMY,U.S. Army S&T Screen — Synthetic Example,Phase II,SBIR,2025-10-14,2026-09-30,EXAMPLEUEI002,1250000,Resilient communications and positioning in contested electromagnetic environments.,541715,AC13,,Integrated Sensing and Cyber,
ARMY-EXAMPLE-003,Illustrative Signature Materials Corp.,Multispectral signature-management materials,DEPARTMENT OF THE ARMY,U.S. Army S&T Screen — Synthetic Example,Phase II,STTR,2026-06-21,2026-12-15,EXAMPLEUEI003,1500000,Adaptive materials for reduced visual infrared and radio-frequency signatures.,541713,AC13,,Advanced Engineering Materials,
ARMY-EXAMPLE-004,Illustrative Expeditionary Logistics Systems LLC,Autonomous resupply and forward repair,DEPARTMENT OF THE ARMY,U.S. Army S&T Screen — Synthetic Example,Phase II,SBIR,2025-08-01,2026-07-31,EXAMPLEUEI004,900000,Autonomous material movement and additive repair for contested logistics.,541715,AC13,,Autonomous Systems,
ARMY-EXAMPLE-005,Illustrative Counter-Swarm Analytics Inc.,Collaborative counter-swarm sensing,DEPARTMENT OF THE ARMY,U.S. Army S&T Screen — Synthetic Example,Phase I,SBIR,2026-06-17,2026-12-20,EXAMPLEUEI005,300000,Distributed sensing and decision support for counter-uncrewed systems.,541715,AC12,,Artificial Intelligence,
